{
    "$schema": "http://json-schema.org/draft-07/schema#",
    "$id": "urn:plasmazones:schema:animation-metadata",
    "title": "PlasmaZones Animation Shader Metadata",
    "description": "metadata.json for a bundled or user animation-shader pack. Core identity and the parameter contract are enforced. Optional rendering keys (vertexShader, fboExtent, textures, appliesTo, geometryGrid), named parameter presets and descriptive metadata (description, author, version, category) are allowed through. Unknown top-level keys are accepted rather than rejected, so this schema will not catch a mis-spelled key such as \"preset\" for \"presets\". The loader ignores anything it does not know.",
    "type": "object",
    "required": ["id", "name", "fragmentShader", "parameters"],
    "properties": {
        "id": { "type": "string", "minLength": 1 },
        "name": { "type": "string", "minLength": 1 },
        "description": { "type": "string" },
        "author": { "type": "string" },
        "version": { "type": "string" },
        "category": { "type": "string" },
        "fragmentShader": { "type": "string", "minLength": 1 },
        "vertexShader": { "type": "string" },
        "presets": {
            "type": "object",
            "maxProperties": 64,
            "description": "Named parameter presets. Each value is a map of parameter id to value, naming a subset of the pack's declared parameters. A preset id is its key here, and it is also the label the picker shows, so it has to read as a name. That rules out control and bidi-formatting characters, and anything longer than a label can show. Unlike a user preset id it never becomes a filename, because duplicating a pack preset mints a fresh UUID. A null value is allowed and means the preset says nothing about that parameter, so it keeps the pack's default; the loader drops the entry. Those rules are checked by plasmazones-shader-validate rather than here, because the vendored JSON-schema validator rejects every name under a propertyNames rule, legitimate ones included.",
            "additionalProperties": {
                "type": "object",
                "maxProperties": 48,
                "additionalProperties": { "type": ["number", "string", "boolean", "null"] }
            }
        },
        "parameters": {
            "type": "array",
            "maxItems": 48,
            "items": { "$ref": "#/definitions/parameter" }
        }
    },
    "definitions": {
        "parameter": {
            "type": "object",
            "required": ["id", "name", "type", "default"],
            "properties": {
                "id": { "type": "string", "minLength": 1 },
                "name": { "type": "string", "minLength": 1 },
                "description": { "type": "string" },
                "type": {
                    "type": "string",
                    "enum": ["float", "int", "bool", "color"],
                    "description": "Marshalling type of the uniform. An unknown type cannot be bound, so it is rejected."
                },
                "default": {
                    "type": ["number", "string", "boolean"],
                    "description": "Default value. Use a string for color (#rrggbb), a number for float or int, and a boolean for bool."
                },
                "min": { "type": "number" },
                "max": { "type": "number" }
            }
        }
    }
}
