{
    "id": "pixel-wipe",
    "name": "Pixel Wipe",
    "description": "Pixelated radial dissolve emanating from a configurable origin point",
    "author": "PlasmaZones",
    "version": "1.0",
    "category": "Pixelation",
    "fragmentShader": "effect.frag",
    "parameters": [
        {
            "id": "maxPixelSize",
            "name": "Max Pixel Size",
            "type": "float",
            "default": 10.0,
            "min": 1.0,
            "max": 50.0
        },
        {
            "id": "originX",
            "name": "Origin X",
            "type": "float",
            "default": 0.5,
            "min": 0.0,
            "max": 1.0
        },
        {
            "id": "originY",
            "name": "Origin Y",
            "type": "float",
            "default": 0.5,
            "min": 0.0,
            "max": 1.0
        }
    ]
}
