{
    "id": "aretha-shell",
    "name": "Aretha Shell",
    "category": "Cyberpunk",
    "description": "Ghost in the Shell inspired cyberpunk effect with color grading, hex grid, and data streams",
    "author": "PlasmaZones",
    "version": "1.0",
    "fragmentShader": "effect.frag",
    "parameters": [
        {
            "id": "speed",
            "name": "Animation Speed",
            "group": "Animation",
            "type": "float",
            "default": 0.08,
            "min": 0.01,
            "max": 0.5
        },
        {
            "id": "gradeIntensity",
            "name": "Color Grade Intensity",
            "group": "Color Grading",
            "type": "float",
            "default": 0.25,
            "min": 0.0,
            "max": 1.0
        },
        {
            "id": "gradeSaturation",
            "name": "Grade Saturation",
            "group": "Color Grading",
            "type": "float",
            "default": 1.08,
            "min": 0.5,
            "max": 2.0
        },
        {
            "id": "shimmerIntensity",
            "name": "Shimmer Intensity",
            "group": "Color Grading",
            "type": "float",
            "default": 0.02,
            "min": 0.0,
            "max": 0.2
        },
        {
            "id": "hexPixelSize",
            "name": "Hex Pixel Size",
            "group": "Hex Grid",
            "type": "float",
            "default": 35.0,
            "min": 10.0,
            "max": 100.0
        },
        {
            "id": "hexLineThickness",
            "name": "Hex Line Thickness",
            "group": "Hex Grid",
            "type": "float",
            "default": 0.05,
            "min": 0.01,
            "max": 0.2
        },
        {
            "id": "hexOpacity",
            "name": "Hex Grid Opacity",
            "group": "Hex Grid",
            "type": "float",
            "default": 0.18,
            "min": 0.0,
            "max": 0.5
        },
        {
            "id": "hexPulseSpeed",
            "name": "Hex Pulse Speed",
            "group": "Hex Grid",
            "type": "float",
            "default": 1.5,
            "min": 0.0,
            "max": 5.0
        },
        {
            "id": "hexScanSpeed",
            "name": "Hex Scan Speed",
            "group": "Hex Grid",
            "type": "float",
            "default": 1.0,
            "min": 0.0,
            "max": 5.0
        },
        {
            "id": "streamColumns",
            "name": "Stream Columns",
            "group": "Data Streams",
            "type": "int",
            "default": 35,
            "min": 5,
            "max": 100
        },
        {
            "id": "streamOpacity",
            "name": "Stream Opacity",
            "group": "Data Streams",
            "type": "float",
            "default": 0.15,
            "min": 0.0,
            "max": 0.5
        },
        {
            "id": "streamSpeed",
            "name": "Stream Speed",
            "group": "Data Streams",
            "type": "float",
            "default": 0.8,
            "min": 0.1,
            "max": 3.0
        },
        {
            "id": "trailLength",
            "name": "Trail Length",
            "group": "Data Streams",
            "type": "float",
            "default": 0.2,
            "min": 0.05,
            "max": 0.5
        },
        {
            "id": "audioSensitivity",
            "name": "Audio Sensitivity",
            "group": "Audio",
            "type": "float",
            "default": 1.0,
            "min": 0.0,
            "max": 2.0
        },
        {
            "id": "fillOpacity",
            "name": "Fill Opacity",
            "group": "Appearance",
            "type": "float",
            "default": 0.95,
            "min": 0.4,
            "max": 1.0
        },
        {
            "id": "dataSurgeIntensity",
            "name": "Data Surge Intensity",
            "group": "Audio",
            "type": "float",
            "default": 1.0,
            "min": 0.0,
            "max": 3.0
        },
        {
            "id": "triLineThickness",
            "name": "Triangle Edge Width",
            "group": "Tri-Hex",
            "type": "float",
            "default": 0.03,
            "min": 0.01,
            "max": 0.15
        },
        {
            "id": "triLineOpacity",
            "name": "Triangle Edge Opacity",
            "group": "Tri-Hex",
            "type": "float",
            "default": 0.25,
            "min": 0.0,
            "max": 1.0
        },
        {
            "id": "triFillOpacity",
            "name": "Wedge Fill Opacity",
            "group": "Tri-Hex",
            "type": "float",
            "default": 0.12,
            "min": 0.0,
            "max": 0.5
        },
        {
            "id": "triPulseSpeed",
            "name": "Wedge Pulse Speed",
            "group": "Tri-Hex",
            "type": "float",
            "default": 2.0,
            "min": 0.0,
            "max": 8.0
        },
        {
            "id": "triRotSpeed",
            "name": "Wedge Rotation Speed",
            "group": "Tri-Hex",
            "type": "float",
            "default": 0.4,
            "min": 0.0,
            "max": 3.0
        },
        {
            "id": "triColorMix",
            "name": "Wedge Color Mix",
            "group": "Tri-Hex",
            "type": "float",
            "default": 0.5,
            "min": 0.0,
            "max": 1.0
        },
        {
            "id": "glitchSpread",
            "name": "Glitch Outline Spread",
            "group": "Labels",
            "type": "float",
            "default": 2.5,
            "min": 1.0,
            "max": 5.0
        },
        {
            "id": "scanlineBright",
            "name": "Scanline Brightness",
            "group": "Labels",
            "type": "float",
            "default": 2.0,
            "min": 1.0,
            "max": 4.0
        },
        {
            "id": "surgeReact",
            "name": "Data Surge Reactivity",
            "group": "Labels",
            "type": "float",
            "default": 1.0,
            "min": 0.0,
            "max": 2.0
        },
        {
            "id": "glitchFrequency",
            "name": "Glitch Frequency",
            "group": "Animation",
            "type": "float",
            "default": 0.5,
            "min": 0.1,
            "max": 2.0
        },
        {
            "id": "showLabels",
            "name": "Show Labels",
            "group": "Labels",
            "type": "bool",
            "default": true
        },
        {
            "id": "arethaCyan",
            "name": "Edge & Glow",
            "group": "Colors",
            "type": "color",
            "default": "#55aaff"
        },
        {
            "id": "arethaPink",
            "name": "Warm Accent",
            "group": "Colors",
            "type": "color",
            "default": "#ff557f"
        },
        {
            "id": "arethaTeal",
            "name": "Stream Color",
            "group": "Colors",
            "type": "color",
            "default": "#009ebd"
        },
        {
            "id": "arethaPurple",
            "name": "Cycle Accent",
            "group": "Colors",
            "type": "color",
            "default": "#5555ff"
        },
        {
            "id": "backgroundColor",
            "name": "Background Color",
            "group": "Colors",
            "type": "color",
            "default": "#192742"
        },
        {
            "id": "triColor1",
            "name": "Wedge Primary",
            "group": "Tri-Hex",
            "type": "color",
            "default": "#ff3388"
        },
        {
            "id": "triColor2",
            "name": "Wedge Secondary",
            "group": "Tri-Hex",
            "type": "color",
            "default": "#ff734d"
        },
        {
            "id": "triLineColor",
            "name": "Triangle Edge Color",
            "group": "Tri-Hex",
            "type": "color",
            "default": "#e626b3"
        }
    ]
}
