{
    "id": "tumbleweed-drift",
    "name": "Tumbleweed Drift",
    "category": "Branded",
    "description": "A warm desert horizon with wind-carved sand dune textures, rolling tumbleweed pinwheel logos, dust devil vortices, parallax sand particles, erosion flow lines, and bass shockwave rings. The audio reactivity drives wind intensity, multi-layer logo glow, treble sand glints, a sandstorm band, wind-etched sandstone labels, and an iridescent inner glow. Enable CAVA audio visualization in settings.",
    "author": "PlasmaZones",
    "version": "2.0",
    "fragmentShader": "effect.frag",
    "parameters": [
        {
            "id": "speed",
            "name": "Animation Speed",
            "group": "Animation",
            "type": "float",
            "slot": 0,
            "default": 0.08,
            "min": 0.01,
            "max": 0.5
        },
        {
            "id": "flowSpeed",
            "name": "Wind Speed",
            "group": "Animation",
            "type": "float",
            "slot": 1,
            "default": 0.15,
            "min": 0.05,
            "max": 1.0
        },
        {
            "id": "noiseScale",
            "name": "Wind Detail",
            "group": "Pattern",
            "type": "float",
            "slot": 2,
            "default": 3.5,
            "min": 1.0,
            "max": 10.0
        },
        {
            "id": "windDirection",
            "name": "Wind Direction",
            "group": "Pattern",
            "type": "float",
            "slot": 3,
            "default": 0.3,
            "min": 0.0,
            "max": 1.0
        },
        {
            "id": "brightness",
            "name": "Brightness",
            "group": "Colors",
            "type": "float",
            "slot": 4,
            "default": 0.7,
            "min": 0.2,
            "max": 1.0
        },
        {
            "id": "contrast",
            "name": "Contrast",
            "group": "Colors",
            "type": "float",
            "slot": 5,
            "default": 0.9,
            "min": 0.5,
            "max": 1.5
        },
        {
            "id": "innerGlowStrength",
            "name": "Inner Glow Strength",
            "group": "Appearance",
            "type": "float",
            "slot": 7,
            "default": 0.4,
            "min": 0.0,
            "max": 0.8
        },
        {
            "id": "fillOpacity",
            "name": "Fill Opacity",
            "group": "Zone",
            "type": "float",
            "slot": 8,
            "default": 0.85,
            "min": 0.5,
            "max": 1.0
        },
        {
            "id": "borderGlow",
            "name": "Border Glow",
            "group": "Zone",
            "type": "float",
            "slot": 9,
            "default": 0.35,
            "min": 0.0,
            "max": 1.0
        },
        {
            "id": "edgeFadeStart",
            "name": "Edge Fade Start",
            "group": "Zone",
            "type": "float",
            "slot": 10,
            "default": 30.0,
            "min": 5.0,
            "max": 60.0,
            "unit": "px"
        },
        {
            "id": "borderBrightness",
            "name": "Border Brightness",
            "group": "Zone",
            "type": "float",
            "slot": 11,
            "default": 1.4,
            "min": 0.8,
            "max": 2.0
        },
        {
            "id": "audioReactivity",
            "name": "Audio Reactivity",
            "group": "Audio",
            "type": "float",
            "slot": 12,
            "default": 1.0,
            "min": 0.0,
            "max": 2.0
        },
        {
            "id": "particleStrength",
            "name": "Sand Particles",
            "group": "Atmosphere",
            "type": "float",
            "slot": 13,
            "default": 0.5,
            "min": 0.0,
            "max": 1.0
        },
        {
            "id": "dustDevilStrength",
            "name": "Dust Devils",
            "group": "Atmosphere",
            "type": "float",
            "slot": 14,
            "default": 0.4,
            "min": 0.0,
            "max": 1.0
        },
        {
            "id": "erosionStrength",
            "name": "Erosion Lines",
            "group": "Pattern",
            "type": "float",
            "slot": 15,
            "default": 0.3,
            "min": 0.0,
            "max": 0.8
        },
        {
            "id": "labelGlowSpread",
            "name": "Label Halo Spread",
            "group": "Labels",
            "type": "float",
            "slot": 16,
            "default": 3.0,
            "min": 1.0,
            "max": 6.0
        },
        {
            "id": "labelBrightness",
            "name": "Label Brightness",
            "group": "Labels",
            "type": "float",
            "slot": 17,
            "default": 2.5,
            "min": 1.0,
            "max": 4.0
        },
        {
            "id": "labelAudioReact",
            "name": "Label Reactivity",
            "group": "Labels",
            "type": "float",
            "slot": 18,
            "default": 1.0,
            "min": 0.0,
            "max": 2.0
        },
        {
            "id": "logoScale",
            "name": "Logo Scale",
            "group": "Logo",
            "type": "float",
            "slot": 20,
            "default": 0.35,
            "min": 0.1,
            "max": 1.0
        },
        {
            "id": "logoIntensity",
            "name": "Logo Intensity",
            "group": "Logo",
            "type": "float",
            "slot": 21,
            "default": 0.8,
            "min": 0.0,
            "max": 1.5
        },
        {
            "id": "logoPulse",
            "name": "Logo Bass Pulse",
            "group": "Logo",
            "type": "float",
            "slot": 22,
            "default": 0.8,
            "min": 0.0,
            "max": 2.0
        },
        {
            "id": "logoCount",
            "name": "Logo Count",
            "group": "Logo",
            "type": "int",
            "slot": 23,
            "default": 3,
            "min": 1,
            "max": 8
        },
        {
            "id": "logoSizeMin",
            "name": "Logo Size Min",
            "group": "Logo",
            "type": "float",
            "slot": 24,
            "default": 0.4,
            "min": 0.1,
            "max": 1.0
        },
        {
            "id": "logoSizeMax",
            "name": "Logo Size Max",
            "group": "Logo",
            "type": "float",
            "slot": 25,
            "default": 1.0,
            "min": 0.3,
            "max": 1.5
        },
        {
            "id": "logoSpin",
            "name": "Logo Spin Speed",
            "group": "Logo",
            "type": "float",
            "slot": 26,
            "default": 0.3,
            "min": 0.0,
            "max": 1.0
        },
        {
            "id": "idleStrength",
            "name": "Idle Animation",
            "group": "Animation",
            "type": "float",
            "slot": 27,
            "default": 0.6,
            "min": 0.0,
            "max": 1.0
        },
        {
            "id": "showLabels",
            "name": "Show Labels",
            "group": "Labels",
            "type": "bool",
            "slot": 29,
            "default": true
        },
        {
            "id": "sparkleIntensity",
            "name": "Spark Intensity",
            "group": "Audio",
            "type": "float",
            "slot": 31,
            "default": 2.0,
            "min": 0.0,
            "max": 5.0
        },
        {
            "id": "primaryColor",
            "name": "Primary (Desert Night)",
            "group": "Palette",
            "type": "color",
            "slot": 0,
            "default": "#1a3a4a"
        },
        {
            "id": "secondaryColor",
            "name": "Secondary (Sandy Tan)",
            "group": "Palette",
            "type": "color",
            "slot": 1,
            "default": "#c4956a"
        },
        {
            "id": "accentColor",
            "name": "Accent (Tumbleweed Teal)",
            "group": "Palette",
            "type": "color",
            "slot": 2,
            "default": "#35b9ab"
        },
        {
            "id": "glowColor",
            "name": "Glow (openSUSE Green)",
            "group": "Palette",
            "type": "color",
            "slot": 3,
            "default": "#73ba25"
        }
    ]
}
