{
    "id": "hexagon",
    "name": "Hexagon",
    "description": "Tron-style hex-tile dissolve — window splits into shrinking hexagonal tiles overlaid with glowing edge lines",
    "author": "PlasmaZones",
    "version": "1.0",
    "category": "Tile",
    "fragmentShader": "effect.frag",
    "parameters": [
        {
            "id": "additiveBlending",
            "name": "Additive Blending",
            "type": "bool",
            "default": true
        },
        {
            "id": "seedX",
            "name": "Seed X",
            "type": "float",
            "default": 0.5,
            "min": 0.0,
            "max": 1.0
        },
        {
            "id": "seedY",
            "name": "Seed Y",
            "type": "float",
            "default": 0.5,
            "min": 0.0,
            "max": 1.0
        },
        {
            "id": "tileScale",
            "name": "Tile Scale",
            "type": "float",
            "default": 1.5,
            "min": 0.3,
            "max": 5.0
        },
        {
            "id": "lineWidth",
            "name": "Line Width",
            "type": "float",
            "default": 1.5,
            "min": 0.1,
            "max": 5.0
        },
        {
            "id": "glowColor",
            "name": "Glow Color",
            "type": "color",
            "default": "#FF00B3FF"
        },
        {
            "id": "lineColor",
            "name": "Line Color",
            "type": "color",
            "default": "#FF99F2FF"
        }
    ]
}
