{
    "id": "toxic-circuit",
    "name": "Toxic Circuit",
    "category": "Cyberpunk",
    "description": "Cyberpunk venom overlay with glowing circuit traces, toxic drip effects, digital corruption, and neon shimmer - inspired by Neon Venom aesthetic",
    "author": "PlasmaZones",
    "version": "1.0",
    "fragmentShader": "effect.frag",
    "parameters": [
        {
            "id": "circuitDensity",
            "name": "Circuit Density",
            "group": "Circuit",
            "type": "int",
            "slot": 0,
            "default": 12,
            "min": 4,
            "max": 20
        },
        {
            "id": "pulseSpeed",
            "name": "Pulse Speed",
            "group": "Animation",
            "type": "float",
            "slot": 1,
            "default": 1.0,
            "min": 0.3,
            "max": 3.0
        },
        {
            "id": "dripIntensity",
            "name": "Toxic Drip",
            "group": "Effects",
            "type": "float",
            "slot": 2,
            "default": 0.2,
            "min": 0.0,
            "max": 1.0
        },
        {
            "id": "glitchAmount",
            "name": "Digital Glitch",
            "group": "Effects",
            "type": "float",
            "slot": 3,
            "default": 0.08,
            "min": 0.0,
            "max": 0.5
        },
        {
            "id": "glowStrength",
            "name": "Neon Glow",
            "group": "Appearance",
            "type": "float",
            "slot": 4,
            "default": 1.0,
            "min": 0.3,
            "max": 3.0
        },
        {
            "id": "smogDensity",
            "name": "Smog Haze",
            "group": "Effects",
            "type": "float",
            "slot": 5,
            "default": 0.1,
            "min": 0.0,
            "max": 0.5
        },
        {
            "id": "fillOpacity",
            "name": "Fill Opacity",
            "group": "Appearance",
            "type": "float",
            "slot": 7,
            "default": 0.7,
            "min": 0.3,
            "max": 0.9
        },
        {
            "id": "edgeGlowStrength",
            "name": "Edge Glow",
            "group": "Appearance",
            "type": "float",
            "slot": 8,
            "default": 0.35,
            "min": 0.0,
            "max": 0.8
        },
        {
            "id": "mouseInfluenceStrength",
            "name": "Mouse Influence",
            "group": "Interaction",
            "type": "float",
            "slot": 9,
            "default": 1.5,
            "min": 0.5,
            "max": 3.0
        },
        {
            "id": "audioSensitivity",
            "name": "Audio Sensitivity",
            "group": "Audio",
            "type": "float",
            "slot": 10,
            "default": 1.0,
            "min": 0.0,
            "max": 2.0
        },
        {
            "id": "sparkIntensity",
            "name": "Spark Intensity",
            "group": "Audio",
            "type": "float",
            "slot": 11,
            "default": 1.0,
            "min": 0.0,
            "max": 3.0
        },
        {
            "id": "arcSpread",
            "name": "Arc Discharge Spread",
            "group": "Labels",
            "type": "float",
            "slot": 12,
            "default": 3.0,
            "min": 1.0,
            "max": 6.0
        },
        {
            "id": "dischargeBright",
            "name": "Discharge Brightness",
            "group": "Labels",
            "type": "float",
            "slot": 13,
            "default": 2.2,
            "min": 1.0,
            "max": 4.0
        },
        {
            "id": "toxicReact",
            "name": "Toxic Reactivity",
            "group": "Labels",
            "type": "float",
            "slot": 14,
            "default": 1.0,
            "min": 0.0,
            "max": 2.0
        },
        {
            "id": "dripCount",
            "name": "Toxic Drip Count",
            "group": "Effects",
            "type": "int",
            "slot": 15,
            "default": 5,
            "min": 2,
            "max": 10
        },
        {
            "id": "arcFrequency",
            "name": "Arc Noise Frequency",
            "group": "Effects",
            "type": "int",
            "slot": 16,
            "default": 12,
            "min": 4,
            "max": 24
        },
        {
            "id": "showLabels",
            "name": "Show Labels",
            "group": "Labels",
            "type": "bool",
            "slot": 17,
            "default": true
        },
        {
            "id": "primaryColor",
            "name": "Primary Color",
            "group": "Colors",
            "type": "color",
            "slot": 0,
            "default": "#39FF14"
        },
        {
            "id": "secondaryColor",
            "name": "Secondary Color",
            "group": "Colors",
            "type": "color",
            "slot": 1,
            "default": "#BF00FF"
        },
        {
            "id": "arcColor",
            "name": "Arc Discharge Color",
            "group": "Colors",
            "type": "color",
            "slot": 2,
            "default": "#00ff88"
        },
        {
            "id": "smogColor",
            "name": "Smog Tint",
            "group": "Colors",
            "type": "color",
            "slot": 3,
            "default": "#1a0033"
        }
    ]
}
