{
    "id": "cosmic-flow",
    "name": "Cosmic Flow",
    "category": "Organic",
    "description": "Flowing fractal noise with an animated color palette and mesmerizing organic patterns",
    "author": "PlasmaZones",
    "version": "1.0",
    "fragmentShader": "effect.frag",
    "parameters": [
        {
            "id": "speed",
            "name": "Animation Speed",
            "group": "Animation",
            "type": "float",
            "default": 0.1,
            "min": 0.01,
            "max": 0.5
        },
        {
            "id": "flowSpeed",
            "name": "Flow Speed",
            "group": "Animation",
            "type": "float",
            "default": 0.3,
            "min": 0.05,
            "max": 1.0
        },
        {
            "id": "noiseScale",
            "name": "Noise Scale",
            "group": "Pattern",
            "type": "float",
            "default": 3.0,
            "min": 1.0,
            "max": 10.0
        },
        {
            "id": "octaves",
            "name": "Detail Level",
            "group": "Pattern",
            "type": "int",
            "default": 6,
            "min": 2,
            "max": 8
        },
        {
            "id": "colorShift",
            "name": "Color Shift",
            "group": "Colors",
            "type": "float",
            "default": 0.0,
            "min": 0.0,
            "max": 1.0
        },
        {
            "id": "saturation",
            "name": "Saturation",
            "group": "Colors",
            "type": "float",
            "default": 0.5,
            "min": 0.1,
            "max": 1.0
        },
        {
            "id": "brightness",
            "name": "Brightness",
            "group": "Colors",
            "type": "float",
            "default": 0.5,
            "min": 0.2,
            "max": 1.0
        },
        {
            "id": "contrast",
            "name": "Contrast",
            "group": "Colors",
            "type": "float",
            "default": 0.95,
            "min": 0.5,
            "max": 1.5
        },
        {
            "id": "fillOpacity",
            "name": "Fill Opacity",
            "group": "Zone",
            "type": "float",
            "default": 0.85,
            "min": 0.5,
            "max": 1.0
        },
        {
            "id": "borderGlow",
            "name": "Border Glow",
            "group": "Zone",
            "type": "float",
            "default": 0.3,
            "min": 0.0,
            "max": 1.0
        },
        {
            "id": "edgeFadeStart",
            "name": "Edge Fade Start",
            "group": "Zone",
            "type": "float",
            "default": 30.0,
            "min": 5.0,
            "max": 60.0
        },
        {
            "id": "borderBrightness",
            "name": "Border Brightness",
            "group": "Zone",
            "type": "float",
            "default": 1.3,
            "min": 0.8,
            "max": 2.0
        },
        {
            "id": "audioReactivity",
            "name": "Audio Reactivity",
            "group": "Audio",
            "type": "float",
            "default": 1.0,
            "min": 0.0,
            "max": 2.0
        },
        {
            "id": "veinDetail",
            "name": "Vein Detail",
            "group": "Pattern",
            "type": "float",
            "default": 0.25,
            "min": 0.0,
            "max": 0.6
        },
        {
            "id": "innerGlowStrength",
            "name": "Inner Glow Strength",
            "group": "Appearance",
            "type": "float",
            "default": 0.25,
            "min": 0.0,
            "max": 0.5
        },
        {
            "id": "sparkleIntensity",
            "name": "Sparkle Intensity",
            "group": "Audio",
            "type": "float",
            "default": 2.5,
            "min": 0.0,
            "max": 5.0
        },
        {
            "id": "nebulaSpread",
            "name": "Nebula Halo Spread",
            "group": "Labels",
            "type": "float",
            "default": 3.0,
            "min": 1.0,
            "max": 6.0
        },
        {
            "id": "lensIntensity",
            "name": "Nebula Lens Intensity",
            "group": "Labels",
            "type": "float",
            "default": 2.5,
            "min": 1.0,
            "max": 4.0
        },
        {
            "id": "stellarReact",
            "name": "Stellar Reactivity",
            "group": "Labels",
            "type": "float",
            "default": 1.0,
            "min": 0.0,
            "max": 2.0
        },
        {
            "id": "fbmRotation",
            "name": "FBM Rotation Angle",
            "group": "Pattern",
            "type": "float",
            "default": 0.5,
            "min": 0.1,
            "max": 1.5
        },
        {
            "id": "showLabels",
            "name": "Show Labels",
            "group": "Appearance",
            "type": "bool",
            "default": true
        },
        {
            "id": "paletteColorA",
            "name": "Palette Base",
            "group": "Palette",
            "type": "color",
            "default": "#808080"
        },
        {
            "id": "paletteColorB",
            "name": "Palette Amplitude",
            "group": "Palette",
            "type": "color",
            "default": "#808080"
        },
        {
            "id": "paletteColorC",
            "name": "Palette Frequency",
            "group": "Palette",
            "type": "color",
            "default": "#ffffff"
        },
        {
            "id": "paletteColorD",
            "name": "Palette Phase",
            "group": "Palette",
            "type": "color",
            "default": "#001a33"
        }
    ]
}
