{
    "id": "sonic-ripple",
    "name": "Sonic Ripple",
    "category": "Audio Visualizer",
    "description": "Concentric audio rings radiate from the zone center \u2014 bass kicks launch expanding shockwaves, mids drive ring density, treble sparks the edges. Every beat is visible. Enable CAVA audio visualization in settings.",
    "author": "PlasmaZones",
    "version": "1.0",
    "fragmentShader": "effect.frag",
    "parameters": [
        {
            "id": "reactivity",
            "name": "Audio Reactivity",
            "group": "Audio",
            "type": "float",
            "default": 1.5,
            "min": 0.5,
            "max": 3.0
        },
        {
            "id": "ringCount",
            "name": "Spectrum Rings",
            "group": "Audio",
            "type": "int",
            "default": 24,
            "min": 8,
            "max": 48
        },
        {
            "id": "ringSpeed",
            "name": "Ring Expansion Speed",
            "group": "Animation",
            "type": "float",
            "default": 1.0,
            "min": 0.2,
            "max": 3.0
        },
        {
            "id": "rotationSpeed",
            "name": "Rotation Speed",
            "group": "Animation",
            "type": "float",
            "default": 0.15,
            "min": 0.0,
            "max": 0.5
        },
        {
            "id": "idleAnimation",
            "name": "Idle Animation",
            "group": "Animation",
            "type": "float",
            "default": 1.0,
            "min": 0.0,
            "max": 2.0
        },
        {
            "id": "glowIntensity",
            "name": "Glow Intensity",
            "group": "Appearance",
            "type": "float",
            "default": 2.0,
            "min": 0.5,
            "max": 4.0
        },
        {
            "id": "fillOpacity",
            "name": "Fill Opacity",
            "group": "Appearance",
            "type": "float",
            "default": 0.88,
            "min": 0.5,
            "max": 1.0
        },
        {
            "id": "resonanceSpread",
            "name": "Resonance Ring Spread",
            "group": "Labels",
            "type": "float",
            "default": 3.0,
            "min": 1.0,
            "max": 6.0
        },
        {
            "id": "ringIntensity",
            "name": "Ring Core Intensity",
            "group": "Labels",
            "type": "float",
            "default": 2.0,
            "min": 1.0,
            "max": 4.0
        },
        {
            "id": "waveReact",
            "name": "Wave Reactivity",
            "group": "Labels",
            "type": "float",
            "default": 1.0,
            "min": 0.0,
            "max": 2.0
        },
        {
            "id": "nebulaScale",
            "name": "Nebula Scale",
            "group": "Background",
            "type": "float",
            "default": 8.0,
            "min": 3.0,
            "max": 16.0
        },
        {
            "id": "showLabels",
            "name": "Show Labels",
            "group": "Labels",
            "type": "bool",
            "default": true
        },
        {
            "id": "primaryColor",
            "name": "Primary Color",
            "group": "Colors",
            "type": "color",
            "default": "#00ccff"
        },
        {
            "id": "accentColor",
            "name": "Accent Color",
            "group": "Colors",
            "type": "color",
            "default": "#ff3399"
        },
        {
            "id": "bassColor",
            "name": "Bass Color",
            "group": "Colors",
            "type": "color",
            "default": "#ff6600"
        }
    ]
}
