{
    "id": "randomsquares",
    "name": "Random Squares",
    "description": "Random-grid block reveal — each cell flips on at its own threshold with a soft window.",
    "author": "PlasmaZones (ported from liixini/shaders, https://github.com/liixini/shaders)",
    "version": "1.0",
    "category": "Tile",
    "fragmentShader": "effect.frag",
    "parameters": [
        {
            "id": "gridDensity",
            "name": "Grid Density",
            "type": "float",
            "default": 10.0,
            "min": 2.0,
            "max": 50.0
        },
        {
            "id": "cellSmoothness",
            "name": "Edge Softness",
            "type": "float",
            "default": 0.5,
            "min": 0.0,
            "max": 1.0
        }
    ]
}
