{
    "id": "fade",
    "name": "Fade",
    "description": "Gentle scale-and-fade transition. Open eases scale 0.95→1.0 with smoothstep(0,0.8) fade-in; close eases scale 1.0→0.95 with smoothstep(1.0,0.2) fade-out.",
    "author": "PlasmaZones (ported from liixini/shaders, https://github.com/liixini/shaders)",
    "version": "1.0",
    "category": "Fade",
    "fragmentShader": "effect.frag",
    "parameters": [
        {
            "id": "scaleAmount",
            "name": "Zoom Amount",
            "type": "float",
            "default": 0.05,
            "min": 0.0,
            "max": 0.3
        },
        {
            "id": "revealStart",
            "name": "Reveal Start",
            "type": "float",
            "default": 0.0,
            "min": 0.0,
            "max": 0.5
        },
        {
            "id": "revealEnd",
            "name": "Reveal End",
            "type": "float",
            "default": 0.8,
            "min": 0.5,
            "max": 1.0
        }
    ]
}
