{
    "id": "berry-drift",
    "name": "Berry Drift",
    "category": "Organic",
    "description": "Organic metaball blobs in berry and violet tones with mint sparkles, bubblegum glow halos, and a deep purple-black backdrop",
    "author": "PlasmaZones",
    "version": "1.0",
    "fragmentShader": "effect.frag",
    "parameters": [
        {
            "id": "blobScale",
            "name": "Blob Count",
            "group": "Blobs",
            "type": "float",
            "default": 10.0,
            "min": 3.0,
            "max": 16.0
        },
        {
            "id": "blobSoftness",
            "name": "Blob Softness",
            "group": "Blobs",
            "type": "float",
            "default": 0.4,
            "min": 0.1,
            "max": 1.0
        },
        {
            "id": "glowIntensity",
            "name": "Glow Intensity",
            "group": "Glow",
            "type": "float",
            "default": 0.5,
            "min": 0.1,
            "max": 1.0
        },
        {
            "id": "fillOpacity",
            "name": "Fill Opacity",
            "group": "Appearance",
            "type": "float",
            "default": 0.9,
            "min": 0.4,
            "max": 1.0
        },
        {
            "id": "sparkleStr",
            "name": "Sparkle Brightness",
            "group": "Sparkles",
            "type": "float",
            "default": 0.6,
            "min": 0.0,
            "max": 1.0
        },
        {
            "id": "sparkleSize",
            "name": "Sparkle Size",
            "group": "Sparkles",
            "type": "float",
            "default": 1.0,
            "min": 0.5,
            "max": 3.0
        },
        {
            "id": "audioSensitivity",
            "name": "Audio Sensitivity",
            "group": "Audio",
            "type": "float",
            "default": 1.0,
            "min": 0.0,
            "max": 2.0
        },
        {
            "id": "driftSpeed",
            "name": "Drift Speed",
            "group": "Animation",
            "type": "float",
            "default": 0.8,
            "min": 0.1,
            "max": 2.0
        },
        {
            "id": "mintIntensity",
            "name": "Mint Intensity",
            "group": "Sparkles",
            "type": "float",
            "default": 0.4,
            "min": 0.0,
            "max": 1.0
        },
        {
            "id": "bloomWidth",
            "name": "Bloom Width",
            "group": "Glow",
            "type": "float",
            "default": 0.06,
            "min": 0.02,
            "max": 0.15
        },
        {
            "id": "vignetteStrength",
            "name": "Vignette Strength",
            "group": "Appearance",
            "type": "float",
            "default": 0.15,
            "min": 0.0,
            "max": 0.5
        },
        {
            "id": "blobSizeMin",
            "name": "Min Blob Size",
            "group": "Blobs",
            "type": "float",
            "default": 0.05,
            "min": 0.02,
            "max": 0.2
        },
        {
            "id": "blobSizeMax",
            "name": "Max Blob Size",
            "group": "Blobs",
            "type": "float",
            "default": 0.14,
            "min": 0.04,
            "max": 0.3
        },
        {
            "id": "berryPink",
            "name": "Berry Pink",
            "group": "Colors",
            "type": "color",
            "default": "#ff6b9d"
        },
        {
            "id": "mintGreen",
            "name": "Mint Green",
            "group": "Colors",
            "type": "color",
            "default": "#7fffd4"
        },
        {
            "id": "deepViolet",
            "name": "Deep Violet",
            "group": "Colors",
            "type": "color",
            "default": "#6b21a8"
        },
        {
            "id": "bubblegum",
            "name": "Bubblegum",
            "group": "Colors",
            "type": "color",
            "default": "#ff9ecf"
        },
        {
            "id": "backgroundColor",
            "name": "Background",
            "group": "Colors",
            "type": "color",
            "default": "#150d20"
        },
        {
            "id": "lavender",
            "name": "Lavender",
            "group": "Colors",
            "type": "color",
            "default": "#c4b5fd"
        },
        {
            "id": "haloRadius",
            "name": "Frosted Halo Radius",
            "group": "Labels",
            "type": "float",
            "default": 3.0,
            "min": 1.0,
            "max": 6.0
        },
        {
            "id": "coreGlow",
            "name": "Core Glow Intensity",
            "group": "Labels",
            "type": "float",
            "default": 2.0,
            "min": 1.0,
            "max": 4.0
        },
        {
            "id": "sparkleReact",
            "name": "Sparkle Reactivity",
            "group": "Labels",
            "type": "float",
            "default": 1.0,
            "min": 0.0,
            "max": 2.0
        },
        {
            "id": "sparkleGrid",
            "name": "Sparkle Grid Density",
            "group": "Sparkles",
            "type": "float",
            "default": 8.0,
            "min": 4.0,
            "max": 16.0
        },
        {
            "id": "rimWidth",
            "name": "Rim Glow Width",
            "group": "Glow",
            "type": "float",
            "default": 0.025,
            "min": 0.005,
            "max": 0.06
        },
        {
            "id": "showLabels",
            "name": "Show Labels",
            "group": "Labels",
            "type": "bool",
            "default": true
        }
    ]
}
