{
    "id": "overexposure",
    "name": "Overexposure",
    "description": "Brightness-pumped fade — channel intensities lift over a sin-modulated envelope while alpha fades.",
    "author": "PlasmaZones (ported from liixini/shaders, https://github.com/liixini/shaders)",
    "version": "1.0",
    "category": "Fade",
    "fragmentShader": "effect.frag",
    "parameters": [
        {
            "id": "strength",
            "name": "Boost Strength",
            "type": "float",
            "default": 0.6,
            "min": 0.0,
            "max": 1.5
        }
    ]
}
