{
    "id": "spectrum-bloom",
    "name": "Spectrum Bloom",
    "category": "Audio Visualizer",
    "description": "A polar spectrum contour seen through the zone, morphing with the full frequency spectrum. Bass to treble maps around the circle, and every bar defines the shape. Works best with 256 spectrum bars. Enable CAVA audio visualization in settings.",
    "author": "PlasmaZones",
    "version": "1.0",
    "fragmentShader": "effect.frag",
    "parameters": [
        {
            "id": "reactivity",
            "name": "Audio Reactivity",
            "group": "Audio",
            "type": "float",
            "default": 1.5,
            "min": 0.5,
            "max": 3
        },
        {
            "id": "contourScale",
            "name": "Contour Scale",
            "group": "Audio",
            "type": "float",
            "default": 0.4,
            "min": 0.2,
            "max": 0.6
        },
        {
            "id": "baseRadius",
            "name": "Base Radius",
            "group": "Appearance",
            "type": "float",
            "default": 0.12,
            "min": 0.05,
            "max": 0.3
        },
        {
            "id": "glowWidth",
            "name": "Glow Width",
            "group": "Appearance",
            "type": "float",
            "default": 0.04,
            "min": 0.02,
            "max": 0.1
        },
        {
            "id": "idleAnimation",
            "name": "Idle Animation",
            "group": "Animation",
            "type": "float",
            "default": 1,
            "min": 0,
            "max": 2
        },
        {
            "id": "nebulaIntensity",
            "name": "Nebula Intensity",
            "group": "Background",
            "type": "float",
            "default": 0.2,
            "min": 0.0,
            "max": 0.5
        },
        {
            "id": "coreGlowStrength",
            "name": "Core Glow",
            "group": "Background",
            "type": "float",
            "default": 0.2,
            "min": 0.0,
            "max": 0.5
        },
        {
            "id": "auroraIntensity",
            "name": "Aurora Intensity",
            "group": "Background",
            "type": "float",
            "default": 0.15,
            "min": 0.0,
            "max": 0.4
        },
        {
            "id": "sparkleSize",
            "name": "Sparkle Size",
            "group": "Particles",
            "type": "float",
            "default": 1.0,
            "min": 0.3,
            "max": 2.0
        },
        {
            "id": "fillOpacity",
            "name": "Fill Opacity",
            "group": "Appearance",
            "type": "float",
            "default": 0.85,
            "min": 0.4,
            "max": 1.0
        },
        {
            "id": "outlineSpread",
            "name": "Rainbow Outline Spread",
            "group": "Labels",
            "type": "float",
            "default": 2.5,
            "min": 1.0,
            "max": 5.0
        },
        {
            "id": "spectrumBright",
            "name": "Spectrum Core Brightness",
            "group": "Labels",
            "type": "float",
            "default": 2.2,
            "min": 1.0,
            "max": 4.0
        },
        {
            "id": "bassPulse",
            "name": "Bass Outline Pulse",
            "group": "Labels",
            "type": "float",
            "default": 1.0,
            "min": 0.0,
            "max": 2.0
        },
        {
            "id": "auroraRayCount",
            "name": "Aurora Ray Count",
            "group": "Background",
            "type": "int",
            "default": 12,
            "min": 4,
            "max": 24
        },
        {
            "id": "showLabels",
            "name": "Show Labels",
            "group": "Labels",
            "type": "bool",
            "default": true
        },
        {
            "id": "primaryColor",
            "name": "Primary Color",
            "group": "Colors",
            "type": "color",
            "default": "#00e6ff"
        },
        {
            "id": "accentColor",
            "name": "Accent Color",
            "group": "Colors",
            "type": "color",
            "default": "#ff3399"
        },
        {
            "id": "warmColor",
            "name": "Warm / Bass Color",
            "group": "Colors",
            "type": "color",
            "default": "#ff9a1a"
        },
        {
            "id": "midColor",
            "name": "Mid Color",
            "group": "Colors",
            "type": "color",
            "default": "#33ff66"
        },
        {
            "id": "coolColor",
            "name": "Cool / Deep Color",
            "group": "Colors",
            "type": "color",
            "default": "#6622ee"
        }
    ]
}
